{
  "schema_version": "ultrajarvis.delegation-card/v1",
  "card_id": "UJ-CARD-RUN-001-CLAUDE",
  "created_at": "2026-08-17T08:05:23.159Z",
  "created_by": {
    "ai_id": "CHATGPT",
    "product": "ChatGPT Work Mode with GitHub connector"
  },
  "target_ai": "CLAUDE",
  "target_product": "Claude Pro consumer interface via human bridge",
  "mission_id": "UJ-MISSION-M0-COUNCIL-001",
  "task_id": "UJ-RUN-001",
  "task_snapshot": {
    "status": "READY",
    "weight": 13,
    "accepted_weight": 0,
    "priority": "P0"
  },
  "role": "Runtime, Security & Skill Architect",
  "repository_scope": {
    "full_name": "carnascialichristian-wq/ultraJARVIS",
    "read_ref": "3611b1b400cf57b5021bab228a3de9470d6eca5c",
    "write_branch_patterns": [
      "agent/uj-run-001-*"
    ],
    "direct_main_write": false
  },
  "context_digest": "The Program OS exists but has no provider-neutral runtime blueprint. Design contracts and failure semantics without relying on Claude-specific entitlement or a paid API.",
  "input_artifacts": [
    {
      "ref": "docs/ULTRAJARVIS_UNIVERSAL_MASTER_PROMPT.md",
      "sha256": "a3fcdfc97b48e9b1f37e1a1798b0b5e7231309d03ab4e13683622eaf1fa69a87",
      "media_type": "text/markdown",
      "data_class": "C1"
    },
    {
      "ref": "docs/program/SPECIALIST_INPUTS.md",
      "sha256": "72edc3952585fb2c31cafd0fa206ab2e66647d49d3190202adf2eba71593590a",
      "media_type": "text/markdown",
      "data_class": "C1"
    },
    {
      "ref": "docs/program/COUNCIL_PACKETS.md",
      "sha256": "eb4d0d0dd46ebdaf07b7ab70380ee80fe0b35da222953f80576749cd3d29ff88",
      "media_type": "text/markdown",
      "data_class": "C1"
    },
    {
      "ref": "schemas/response-packet.schema.json",
      "sha256": "ee44e1b7e262bc0817e0b4f65de8830d122687618a59774fdabfddf3b7e69c0a",
      "media_type": "application/schema+json",
      "data_class": "C1"
    }
  ],
  "instructions": "Read every listed artifact at the pinned commit. Produce docs/architecture/RUNTIME_BLUEPRINT.md plus draft TypeScript or JSON schemas where useful. Cover AgentManifest, TeamSpec, Supervisor state machine, DepthGuard, RunLedger events, checkpoint/resume/cancel/retry/idempotency, tool allowlist inheritance, typed artifact communication, failure and loop scenarios, threat notes for UJ-SEC-001, and an integration review checklist. Keep UJ-CLD-001 entitlement research separate. If GitHub write is unavailable, return complete file contents. End with one ResponsePacket for UJ-RUN-001 proposing REVIEW with accepted weight still 0/13.",
  "required_output_schema": "ultrajarvis.response-packet/v1",
  "acceptance_criteria": [
    {
      "criterion_id": "AC-01",
      "text": "Runtime blueprint defines AgentManifest, TeamSpec, Supervisor, DepthGuard, and RunLedger as provider-neutral contracts.",
      "verification": "Provide an artifact path/hash and a concrete check for criterion 1."
    },
    {
      "criterion_id": "AC-02",
      "text": "Checkpoint, cancellation, retry, idempotency, loop, replay, and failure containment semantics are binary-testable.",
      "verification": "Provide an artifact path/hash and a concrete check for criterion 2."
    },
    {
      "criterion_id": "AC-03",
      "text": "Tool access is default-deny and never inherited implicitly.",
      "verification": "Provide an artifact path/hash and a concrete check for criterion 3."
    },
    {
      "criterion_id": "AC-04",
      "text": "Proposed schemas and integration checklist are complete enough for ChatGPT and Gemini review.",
      "verification": "Provide an artifact path/hash and a concrete check for criterion 4."
    },
    {
      "criterion_id": "AC-05",
      "text": "ResponsePacket is valid, cites every artifact hash, proposes REVIEW, and keeps accepted weight at 0/13.",
      "verification": "Provide an artifact path/hash and a concrete check for criterion 5."
    }
  ],
  "forbidden_actions": [
    "Use a paid or pay-per-use API.",
    "Enable billing, create a billing account, or accept overage risk.",
    "Automate a consumer UI, cookie, browser session, or login.",
    "Run heavy model inference on Christian's computer.",
    "Read, request, reveal, or store secret values.",
    "Write directly to main, merge a pull request, deploy production, or create accounts.",
    "Mark the task DONE or award accepted weight without the named independent reviewer.",
    "Perform another primary AI's task or claim that another AI agrees without its packet."
  ],
  "data_class": "C1",
  "allowed_modes": [
    "HUMAN_BRIDGE"
  ],
  "side_effect_limit": "INTERNAL_WRITE",
  "autonomy_ceiling": "L2",
  "tool_allowlist": [
    "AUTHORIZED_GITHUB_READ_IF_AVAILABLE",
    "AUTHORIZED_GITHUB_BRANCH_WRITE_IF_AVAILABLE"
  ],
  "call_budget": {
    "max_model_calls": 1,
    "max_tool_calls": 40,
    "incremental_cost_eur": 0
  },
  "reviewer": "GEMINI",
  "expires_at": "2026-09-17T00:00:00Z",
  "return_channel": {
    "mode": "copy-paste",
    "destination": "Return artifact files and one ResponsePacket JSON to the ChatGPT ultraJARVIS integration session; use a review branch/PR only if GitHub write is actually available.",
    "requires_artifact_hashes": true
  },
  "idempotency_key": "UJ-IDEMP-RUN-001-CLAUDE",
  "status": "READY"
}

